<?xml version="1.0" encoding="UTF-8"?>
<!DOCTYPE var-ddl SYSTEM  "ddlTemplate.dtd">

<var-ddl>
	<!-- 테이블 생성-->
	<tableScript><![CDATA[

	]]></tableScript>

	<!-- view 생성-->
	<viewScript><![CDATA[

	]]></viewScript>

	<!-- function 생성-->
	<functionScript><![CDATA[
		CREATE FUNCTION {{OBJECT_NAME}} ({{ARGUMENTS}}) RETURN {{RETURN_TYPE}}
		AS LANGUAGE {{LANG}}
		NAME {{SOURCE}};
	]]></functionScript>

	<!-- procedure 생성-->
	<procedureScript><![CDATA[
		CREATE PROCEDURE {{OBJECT_NAME}} ({{ARGUMENTS}}) RETURN {{RETURN_TYPE}}
		AS LANGUAGE {{LANG}}
		NAME {{SOURCE}};
	]]></procedureScript>

	<!-- trigger 생성-->
	<triggerScript><![CDATA[
		/* DROP TRIGGER ; */
		CREATE OR REPLACE
	]]></triggerScript>

	<!-- index 생성-->
	<indexScript><![CDATA[

	]]></indexScript>

	<!-- sequence 생성-->
	<sequenceScript><![CDATA[
{{#equals true ddlOption.addDropClause}}/* DROP SERIAL {{OBJECT_NAME}}; */
{{/equals}}

CREATE SERIAL {{OBJECT_NAME}}
START WITH 1
INCREMENT BY {{INCREMENT_BY}}
MINVALUE {{MIN_VALUE}}
MAXVALUE {{MAX_VALUE}}
	]]></sequenceScript>

	<!-- 컬럼 추가-->
	<alterAddColumn><![CDATA[
		alter table {{TABLE_NAME}} add column {{COLUMN_NAME}} {{DATA_TYPE}} {{DEFAULT_VALUE}}
	]]></alterAddColumn>

	<!-- 컬럼명 수정 추가-->
	<alterRenameColumn><![CDATA[
		alter table {{TABLE_NAME}} rename column {{COLUMN_NAME}} as {{NEW_COLUMN_NAME}}
	]]></alterRenameColumn>

	<!-- 컬럼 수정 추가-->
	<alterModifyColumn><![CDATA[
		alter table {{TABLE_NAME}} modify {{COLUMN_NAME}} {{DATA_TYPE}} {{#equals true ddlOption.isNotNull}} not null {{/equals}} {{DEFAULT_VALUE}}
	]]></alterModifyColumn>

	<!-- 컬럼명 수정 추가-->
	<alterDropColumn><![CDATA[
		alter table {{TABLE_NAME}} drop  {{COLUMN_NAME}}
	]]></alterDropColumn>

	<!-- 테이블명 수정 추가-->
	<renameTable><![CDATA[
		rename table  {{TABLE_NAME}} as  {{NEW_TABLE_NAME}}
	]]></renameTable>
</var-ddl>
